{
  "org_id": "freenews-demo",
  "org_name": "FreeNews Demo",
  "key_id": "e6dca844c35f747e",
  "public_key": "MQt-0feaEGyvW1yk26UWsLAdfpWsx0KUJReI_6tsSns",
  "added_at_utc": "2026-05-10T00:00:00Z",
  "source": "known-safe demo handoff",
  "notes": [
    "Example trusted-key handoff shape only; use demo-bundle or trust-export-key for real key material."
  ]
}
